{
  "bc": "periodic",
  "scheme": "euler",
  "order_p": 1,
  "expected_dt_slope": 2,
  "grid": {"N": 128, "dx": 1.0},
  "params": {"D": 1.0, "r": 0.2, "u": 0.25},
  "dt_sweep": [0.04, 0.02, 0.01, 0.005],
  "seeds": 40,
  "safety": {"clamp": false, "nan_to_num": false},
  "cfl_used": true,
  "adjacency": {"kind": "fd_1d_centered"},
  "notes": "Obj-A/B periodic RD; Neumann only used in separate front-speed control runs."
}
